<?xml version="1.0" encoding="UTF-8"?>
<xs:schema xmlns:xs="http://www.w3.org/2001/XMLSchema">

	<xs:element name="basic-blocking" type="basic-blocking-type" />
	<xs:complexType name="basic-blocking-type">
		<xs:sequence>
			<xs:element name="blocking-rounds" type="blocking-rounds" />
		</xs:sequence>
	</xs:complexType>
	<xs:complexType name="blocking-rounds">
		<xs:sequence minOccurs="1" maxOccurs="unbounded">
			<xs:element name="blocking-round" type="blocking-round" />
		</xs:sequence>
	</xs:complexType>
	<xs:complexType name="blocking-round">
		<xs:sequence>
			<xs:element name="blocking-fields" type="blocking-fields" />
		</xs:sequence>
	</xs:complexType>
	<xs:complexType name="blocking-fields">
		<xs:sequence minOccurs="1" maxOccurs="unbounded">
			<xs:element name="blocking-field" type="blocking-field" />
		</xs:sequence>
	</xs:complexType>
	<xs:complexType name="blocking-field">
		<xs:sequence>
			<xs:element name="field-name" type="xs:string" />
		</xs:sequence>
		<xs:attribute name="db-field" type="xs:string" />
		<xs:attribute name="fun-name" type="xs:string" />

	</xs:complexType>


</xs:schema>