<?xml version="1.0" encoding="UTF-8"?>
<basic-blocking xmlns:xsi="http://www.w3.org/2001/XMLSchema-instance"
	xsi:noNamespaceSchemaLocation="blocking.xsd">
	<blocking-rounds>

		<blocking-round>
			<blocking-fields>
				<blocking-field db-field="ID_NO"
					fun-name="com.sinosoft.block.fun.ID18Function">
					<field-name>ID_NO</field-name>
				</blocking-field>
			</blocking-fields>
		</blocking-round>

		<blocking-round>
			<blocking-fields>
				<blocking-field db-field="ID_NO"
					fun-name="com.sinosoft.block.fun.ID15Function">
					<field-name>ID_NO</field-name>
				</blocking-field>
			</blocking-fields>
		</blocking-round>

		<blocking-round>
			<blocking-fields>
				<blocking-field db-field="CARD_NO">
					<field-name>CARD_NO</field-name>
				</blocking-field>
			</blocking-fields>
		</blocking-round>

		<blocking-round>
			<blocking-fields>
				<blocking-field db-field="NH_CARD">
					<field-name>NH_CARD</field-name>
				</blocking-field>
			</blocking-fields>
		</blocking-round>

		<!-- 社会保障卡号 -->
		<blocking-round>
			<blocking-fields>
				<blocking-field db-field="SSCID">
					<field-name>SSCID</field-name>
				</blocking-field>
			</blocking-fields>
		</blocking-round>

		<blocking-round>
			<blocking-fields>
				<blocking-field db-field="HR_ID">
					<field-name>HR_ID</field-name>
				</blocking-field>
			</blocking-fields>
		</blocking-round>

		<!--医疗服务编号 -->
		<!-- <blocking-round> <blocking-fields> <blocking-field db-field="MEDICALSERVICE_NO"> 
			<field-name>MEDICALSERVICE_NO</field-name> </blocking-field> </blocking-fields> 
			</blocking-round> <blocking-round> <blocking-fields> <blocking-field db-field="NAME_CN"> 
			<field-name>NAME_CN</field-name> </blocking-field> <blocking-field db-field="GENDER_CD"> 
			<field-name>GENDER_CD</field-name> </blocking-field> <blocking-field db-field="BIRTH_DATE"> 
			<field-name>BIRTH_DATE</field-name> </blocking-field> <blocking-field db-field="NATIONALITY_CD"> 
			<field-name>NATIONALITY_CD</field-name> </blocking-field> </blocking-fields> 
			</blocking-round> -->



	</blocking-rounds>
</basic-blocking>

